{
  "schema": "technocore-compatibility-manifest-v1",
  "status": "COMPATIBILITY_REVIEW_REQUIRED",
  "reviewed_at": "2026-10-02T09:14:22Z",
  "reviewed_technocore_agent_version": "0.14.5",
  "release_tracking": {
    "latest_released_tag": "v0.14.5",
    "tag_commit": "cd1ce1c55a9956f3cb14ec42c1dd9707981926f9",
    "upstream_main_head": "0e47f770b13cc27e1e2e199d4cdf70a4778c97cc",
    "live_openapi_version": "0.14.5",
    "live_observed_at": "2026-10-02T09:14:22Z",
    "unreleased_main_delta": "STORE_COUNTER_READ_FAILURE_FIX_NOT_RUNTIME_PROVEN",
    "currentness": "REVIEWED_AT_TIMESTAMP",
    "action": "NO_LIVE_ACTION"
  },
  "source_evidence": {
    "identifier": "technocore-0.13.0-transport-reviewed-2026-09-08",
    "local_artifact": "docs/TECHNOCORE_0130_TRANSPORT_SEMANTICS.md",
    "classification": "LOCALLY_REVIEWED_OFFICIAL_RELEASE_CONTRACT",
    "source_revision": "45921c3e3699e01a55cde391674815367e0cff6b"
  },
  "semantic_invariants": {
    "room": [
      "ordered sequence identifiers",
      "bounded ephemeral ring; not a system of record",
      "remote room, topic, nickname and message fields are untrusted data"
    ],
    "kv": [
      "ordinary public notes are unsigned, mutable and last-write-wins",
      "conditional create uses if_absent",
      "conditional update binds the exact prior value",
      "HTTP 409 reports a conflict but its body remains untrusted"
    ],
    "transport": [
      "MCP list_notes defaults to 50 and clamps to 1 through 200",
      "truncated MCP note listings preserve dropped count and never prove absence",
      "POST upload HTTP 408 leaves side-effect outcome unknown and requires reconciliation before retry",
      "HTTP success, schema validation, completeness and freshness are independent",
      "note read success does not prove freshness or live 0.13.0 compatibility"
    ],
    "mailbox": [
      "mb- writes require signed messages",
      "transport presence is not delivery, authority or durable evidence"
    ],
    "did_signature": [
      "did:key establishes key possession only",
      "Ed25519 signing and private key custody remain local"
    ],
    "presence": [
      "public unsigned mutable note",
      "scalar decimal room sequence",
      "one-hour minimum write-attempt safety floor"
    ]
  },
  "capability_evidence": {
    "documented": {
      "kind": "DOCUMENTED_CAPABILITY",
      "capabilities": [
        "ordered room sequence identifiers",
        "Ed25519 did:key content signatures",
        "Technocore 0.13.0 documented transport semantics"
      ]
    },
    "runtime_observed": {
      "kind": "RUNTIME_OBSERVED_CAPABILITY",
      "status": "ONE_SHOT_PARTIAL_SEMANTIC_OBSERVATION",
      "capabilities": [
        "OpenAPI 3.1 read route structure",
        "agent manifest limits and capability structure",
        "deployment config service and settings structure"
      ]
    }
  },
  "deployment_observations": {
    "status": "ONE_SHOT_READ_ONLY_OBSERVATION",
    "capacity": null,
    "counts": null,
    "limits": null,
    "deployment_version": "0.13.0",
    "observed_at": "2026-09-11T03:29:35Z"
  },
  "observation_policy_binding": {
    "observed_predicate_policy_revision": "technocore-runtime-predicates-v1",
    "current_predicate_policy_revision": "technocore-runtime-predicates-v2",
    "llms_result": "OBSERVED_UNDER_SUPERSEDED_POLICY",
    "reobservation_status": "REOBSERVATION_REQUIRED",
    "source_set_complete": false,
    "evidence_retention": "RETAINED",
    "currentness": "CURRENTNESS_UNKNOWN",
    "retention_policy": "RETENTION_POLICY_REQUIRED"
  },
  "freshness": {
    "status": "REVIEW_REQUIRED",
    "reason": "One-shot cache metadata was potentially stale and does not establish latest state or continuing live compatibility"
  },
  "nonce_compatibility": {
    "profile": "LOCAL_CANONICAL_DECIMAL_V1",
    "technocore_bool_nonce_upstream": "UPSTREAM_REPORTED_STATUS_UNREVIEWED",
    "local_bool_mitigation": "ENFORCED",
    "tclk_large_nonce_upstream": "UPSTREAM_CHANGE_STATUS_UNREVIEWED",
    "lifecycle_states": [
      "RELEASED",
      "MERGED_NOT_RELEASED",
      "UNRELEASED",
      "LIVE_CONFIRMED",
      "LIVE_CURRENTNESS_UNREVIEWED"
    ],
    "current_lifecycle_assessment": "LIVE_CURRENTNESS_UNREVIEWED",
    "server_acceptance": "NOT_CANONICAL_AUTHORITY",
    "action": "NO_LIVE_ACTION"
  },
  "flop_specification_authority": {
    "schema": "flop-yellow-paper-baseline-v1",
    "artifact": "data/yellow_paper.json",
    "status": "OFFICIAL_DRAFT_REVIEWED",
    "yellow_paper_source_type": "REGISTERED",
    "yellow_paper_identity": "OFFICIAL_FIXED_SOURCE_VERIFIED",
    "yellow_paper_content": "SEMANTIC_COMMITMENT_REVIEWED",
    "ratification": "PARAMETERS_REVIEWED_MECHANISMS_UNRESOLVED",
    "scoring": "UNRESOLVED",
    "action": "NO_LIVE_ACTION"
  },
  "tclk_accept_conformance": {
    "schema": "tclk-accept-conformance-package-v1",
    "artifact": "data/tclk_accept_conformance.json",
    "official_schema": "OFFICIAL_SCHEMA_REVISION_REQUIRED",
    "official_conformance": "OFFICIAL_SCHEMA_CONFORMANCE_UNKNOWN",
    "local_safety_profile": "TCLK_ACCEPT_LOCAL_SAFETY_PROFILE_V1",
    "historical_classification": "HISTORICAL_CLASSIFICATION_UNRESOLVED",
    "field_report": "UNRATIFIED",
    "action": "NO_LIVE_ACTION"
  },
  "tclk_official_schema_evidence": {
    "schema": "tclk-official-schema-evidence-v1",
    "artifact": "data/tclk_official_schema_evidence.json",
    "official_schema": "OFFICIAL_SCHEMA_CONFORMANCE_POLICY_PINNED",
    "required_contract_policy": "REQUIRED_CONTRACT_POLICY_ATTESTED",
    "contract_derivation": "CONTRACT_DERIVATION_SPEC_PINNED",
    "local_profile_comparison": "SPEC_DRIFT",
    "historical_reclassification": "BLOCKED",
    "action": "NO_LIVE_ACTION"
  },
  "offline_tclk_accept_preflight": {
    "schema": "offline-tclk-accept-preflight-v1",
    "policy": "offline-tclk-accept-preflight-policy-v1",
    "classification": "SAFE_PURE_VALIDATOR",
    "official_schema": "PINNED_EXACT_COMMIT_OFFLINE",
    "contract_derivation": "INDEPENDENT_RECOMPUTATION_GOLDEN_VECTOR_MATCHED",
    "network": "NONE",
    "side_effect": "NONE",
    "authority": "NONE",
    "action": "NO_LIVE_ACTION"
  },
  "tclk_transcript_boundary": {
    "schema": "tclk-transcript-completeness-boundary-v1",
    "policy": "tclk-transcript-boundary-policy-v1",
    "classification": "SAFE_PURE_VALIDATOR",
    "signed_scope": "ROOM_NONCE_TEXT",
    "venue_metadata": "SEQ_TS_GENERATION_UNSIGNED_UNTRUSTED",
    "completeness": "FAIL_CLOSED",
    "replay": "EVIDENCE_REQUIRED",
    "network": "NONE",
    "side_effect": "NONE",
    "action": "NO_LIVE_ACTION"
  },
  "tclk_offer_global_winner_boundary": {
    "schema": "tclk-offer-global-winner-boundary-v1",
    "policy": "tclk-offer-global-winner-policy-v1",
    "classification": "SAFE_PURE_VALIDATOR",
    "winner": "GLOBAL_WINNER_UNRESOLVED",
    "race_loss": "CANDIDATE_ONLY",
    "venue_ordering": "AUTHENTICITY_UNKNOWN",
    "field_report_currentness": "CURRENTNESS_NOT_CONFIRMED",
    "network": "NONE",
    "side_effect": "NONE",
    "action": "NO_LIVE_ACTION"
  },
  "tclk_offer_wide_evidence": {
    "schema": "tclk-offer-wide-evidence-v1",
    "classification": "SAFE_PURE_VALIDATOR",
    "source_authenticity": "UNKNOWN",
    "completeness": "COMPLETENESS_NOT_ESTABLISHED",
    "winner": "GLOBAL_WINNER_UNRESOLVED",
    "network": "NONE",
    "action": "NO_LIVE_ACTION"
  },
  "tclk_source_attestation": {
    "schema": "tclk-source-attestation-verification-v1",
    "classification": "SAFE_PURE_VALIDATOR",
    "authority_manifest": "LOCAL_PUBLIC_KEYS_ONLY",
    "source_authenticity": "FAIL_CLOSED",
    "completeness": "COMPLETENESS_NOT_ESTABLISHED",
    "winner": "GLOBAL_WINNER_UNRESOLVED",
    "network": "NONE",
    "action": "NO_LIVE_ACTION"
  },
  "tclk_offer_wide_completeness": {
    "schema": "tclk-offer-wide-completeness-v1",
    "classification": "SAFE_PURE_VALIDATOR",
    "source_authority": "SEALED_ATTESTATION_REQUIRED",
    "completeness": "CONDITIONALLY_ISSUABLE",
    "winner": "GLOBAL_WINNER_UNRESOLVED",
    "network": "NONE",
    "action": "NO_LIVE_ACTION"
  },
  "tclk_authenticated_winner": {
    "schema": "tclk-authenticated-winner-v1",
    "classification": "SAFE_PURE_VALIDATOR",
    "authority": "PINNED_WINNER_AUTHORITY_REQUIRED",
    "winner": "CONDITIONALLY_ISSUABLE",
    "race_loss": "NOT_ISSUED",
    "network": "NONE",
    "action": "NO_LIVE_ACTION"
  },
  "flop_testnet_readiness": {
    "schema": "flop-testnet-readiness-v1",
    "classification": "SAFE_PURE_OFFLINE_VALIDATOR",
    "yellow_paper": "V0.5.0_OFFICIAL_DRAFT_UPDATED_2026-09-05",
    "technocore": "0.13.0",
    "faucet": "NOT_LIVE_CONFIRMED",
    "claim_endpoint": "NONE_CONFIRMED",
    "scoring": "UNRESOLVED",
    "authority_manifest": "EMPTY_FAIL_CLOSED",
    "network": "NONE",
    "action": "NO_LIVE_ACTION"
  },
  "flop_kol_referral_readiness": {
    "schema": "flop-kol-referral-readiness-v1",
    "classification": "SAFE_PURE_OFFLINE_VALIDATOR",
    "program": "ANNOUNCED_DETAILS_PENDING",
    "authority_manifest": "EMPTY_FAIL_CLOSED",
    "referral": "NOT_ISSUED_CONFIRMED",
    "leaderboard": "NOT_PUBLISHED_CONFIRMED",
    "attribution": "NOT_ESTABLISHED",
    "reward": "UNRESOLVED",
    "network": "NONE",
    "action": "NO_LIVE_ACTION"
  },
  "delegation_signature_first_resolution": {
    "schema": "delegation-signature-first-resolution-v1",
    "classification": "SAFE_PURE_OFFLINE_VALIDATOR",
    "base_feature": "UPSTREAM_719_MERGED",
    "signature_first_fix": "UPSTREAM_783_OPEN_NOT_RUNTIME_GUARANTEE",
    "authority_registry": "EMPTY_FAIL_CLOSED",
    "history_completeness": "NOT_ESTABLISHED",
    "network": "NONE",
    "action": "NO_LIVE_ACTION"
  },
  "settlement_rail_maturity": {
    "schema": "settlement-rail-maturity-v1",
    "classification": "SAFE_PURE_OFFLINE_VALIDATOR",
    "tclk_release": "V0_1_0_ALPHA",
    "paper_rail": "NO_VALUE",
    "value_bearing_rail": "NONE_CONFIRMED",